achievement,category,metrics,keywords
"Improved student achievement metrics by 25% through data-driven curriculum optimization and targeted interventions","Results","25% improvement","data analysis,metrics,improvement,optimization"
"Managed budget of $15K for classroom resources and educational materials, achieving 100% ROI through strategic allocation","Budget","$15K budget, 100% ROI","budget management,resource allocation,ROI"
"Led cross-functional team of 6 educators to redesign mathematics curriculum, resulting in 30% increase in student engagement scores","Leadership","6 team members, 30% increase","leadership,cross-functional,project management"
"Developed and maintained comprehensive database tracking 150+ students' academic progress, creating automated reports for stakeholder review","Technical","150+ students","database management,reporting,automation,stakeholders"
"Conducted A/B testing on instructional methodologies, using quantitative analysis to optimize learning outcomes","Analysis","A/B testing","testing,quantitative analysis,optimization"
"Presented quarterly performance reports to administration, translating complex data into actionable insights","Communication","Quarterly reporting","presentation,data visualization,stakeholder communication"
"Reduced reporting time by 40% through process automation and standardization of assessment procedures","Efficiency","40% time reduction","process improvement,automation,efficiency"
"Coordinated professional development for 20+ colleagues, improving department-wide implementation of best practices","Training","20+ participants","training,development,coordination"
