education_term,corporate_equivalent,explanation
"Curriculum Development","Process Design","Creating structured frameworks for achieving objectives"
"Student Assessment","Performance Metrics & KPIs","Measuring and tracking outcome indicators"
"Differentiated Instruction","Tailored Solutions","Adapting approach based on stakeholder needs"
"Parent-Teacher Conferences","Stakeholder Management","Regular communication with key stakeholders"
"Classroom Management","Team Leadership","Managing group dynamics and productivity"
"Professional Development","Training & Development","Continuous learning and skill enhancement"
"Data-Driven Instruction","Evidence-Based Decision Making","Using analytics to guide strategy"
"Intervention Programs","Process Improvement Initiatives","Targeted actions to address gaps"
"Standards Alignment","Compliance & Quality Assurance","Ensuring alignment with requirements"
"Collaborative Planning","Cross-Functional Collaboration","Working with diverse teams toward goals"
